{
  "schema_version": "1.0.0",
  "prediction_id": "PR-000001",
  "robot_id": "P2-02",
  "made_at_t_s": 10500,
  "made_at": "2027-03-01T02:55:00Z",
  "fault_mode": "bearing_wear",
  "confidence": 0.78,
  "component": "wheel_fl_drive",
  "subsystem": "MOBILITY",
  "severity": "CRITICAL",
  "candidates": [
    {
      "fault_mode": "bearing_wear",
      "score": 0.78
    },
    {
      "fault_mode": "cooling_fault",
      "score": 0.41
    },
    {
      "fault_mode": "wheel_drag",
      "score": 0.22
    },
    {
      "fault_mode": "battery_degradation",
      "score": 0.02
    }
  ],
  "target_channel": "wheel_fl_temp_c",
  "failure_threshold": {
    "rule": "RELATIVE_CRITICAL_HIGH",
    "limit": 30.0,
    "value_at_threshold": 63.7
  },
  "predicted_ttf_s": 3360,
  "predicted_ttf_interval_s": {
    "low": 2520,
    "high": 4536,
    "confidence_level": 0.8
  },
  "predicted_failure_t_s": 13860,
  "trend": {
    "model": "linear",
    "slope_per_s": 0.004727,
    "intercept": 14.05,
    "r_squared": 0.86,
    "n_points": 1801,
    "units": "degC"
  },
  "signature_observed": {
    "wheel_current": "UP",
    "wheel_speed": "DOWN",
    "wheel_temp": "UP",
    "thermal_residual": "UP",
    "voltage_residual": "NORMAL"
  },
  "residuals": {
    "thermal_residual_c": 10.5,
    "voltage_residual_v": -0.02
  },
  "anomaly_ids": [],
  "evidence_window": {
    "robot_id": "P2-02",
    "start_t_s": 8700,
    "end_t_s": 10500,
    "channels": [
      "wheel_fl_temp_c",
      "wheel_fl_current_a",
      "wheel_fl_speed_rads",
      "wheel_fr_temp_c"
    ],
    "source": "telemetry.parquet"
  }
}
